{
  "$schema": "../schema/ui-framework-adapters.schema.json",
  "schemaVersion": 1,
  "reviewedAt": "2026-09-11",
  "govukFrontendVersion": "6.5.0",
  "adapters": [
    {
      "id": "tailwind",
      "name": "Tailwind CSS",
      "status": "experimental",
      "reviewedAt": "2026-09-11",
      "implementation": {
        "name": "Tailwind CSS",
        "package": "tailwindcss",
        "version": "4.3.3"
      },
      "description": "This adapter exposes reviewed GOV.UK values to Tailwind CSS 4 utilities for service-owned extensions while keeping GOV.UK Frontend responsible for page, component and behaviour CSS. It does not recreate GOV.UK components from utilities or treat a Tailwind theme as evidence of conformance.",
      "output": "tailwind/DESIGN.md",
      "tokenOutput": "tailwind/govuk-theme.css",
      "fixture": "fixtures/tailwind/index.html",
      "fixtureDescription": "The development fixture starts with `npm run fixture:serve:tailwind` and renders `fixtures/tailwind/index.html`. It compiles the generated GOV.UK theme bridge with Tailwind CSS 4.3.3, loads that layered output before unlayered GOV.UK Frontend 6.5.0 CSS, and exercises Button, Text input and Accordion plus a service-owned token example. The fixture is test evidence, not package payload or a starter application.",
      "compatibility": [
        "guidance",
        "token",
        "markup",
        "behaviour-tested"
      ],
      "compatibilityBoundary": "Token utilities are limited to service-owned extensions. Markup and behaviour evidence comes from retaining official GOV.UK Frontend component HTML, classes and JavaScript rather than reconstructing components with Tailwind utilities.",
      "requirements": [
        "Use GOV.UK Frontend CSS, JavaScript and official component markup for GOV.UK components. Tailwind utilities are for service-owned extensions and layout around those components, not replacements for their classes or behaviour.",
        "Treat the generated `govuk-theme.css` as a reviewed Tailwind token bridge. Its utility names expose values; they do not carry GOV.UK usage rules, semantics, responsive component behaviour or accessibility by themselves.",
        "Keep every service journey usable without Tailwind-generated enhancement or GOV.UK Frontend JavaScript. Render native controls, error messages and disclosure content in the initial HTML.",
        "Confirm separately that the service may use GDS Transport, the GOV.UK crown and other protected identity assets. This adapter maps neither a font family nor identity artwork."
      ],
      "installation": [
        "Install the reviewed implementation with `npm install --save-dev --save-exact tailwindcss@4.3.3 @tailwindcss/cli@4.3.3` and install `govuk-frontend@6.5.0 --save-exact`. Use the Tailwind integration appropriate to the host build; the fixture uses the official CLI for reproducible evidence.",
        "Keep `ui-frameworks/tailwind/govuk-theme.css` beside the installed `design/govuk/tokens/govuk.css`, or update its relative import if the files are moved. The bridge consumes the canonical custom properties rather than maintaining a second value source.",
        "Build Tailwind from explicit theme and utilities imports, then load the generated layered stylesheet before the unlayered GOV.UK Frontend stylesheet. Do not use `important` to make utilities override GOV.UK component rules.",
        "Copy GOV.UK Frontend fonts, images and JavaScript to stable application asset URLs. Never hotlink assets from the GOV.UK Design System website or rely on Tailwind to supply them."
      ],
      "preflight": [
        "Do not use the one-line `@import \"tailwindcss\"` in a GOV.UK Frontend stylesheet: it automatically injects Tailwind Preflight, including opinionated margin, heading, list, image and border resets.",
        "Import `tailwindcss/theme.css` and `tailwindcss/utilities.css` individually and omit `tailwindcss/preflight.css`. GOV.UK Frontend supplies its own explicit page, typography, form and component styles.",
        "Keep Tailwind theme and utilities in named cascade layers and GOV.UK Frontend CSS unlayered. Unlayered normal author styles outrank layered normal styles, which prevents an incidental utility from silently winning over an official component selector.",
        "Audit any other reset, normalize stylesheet, CSS-in-JS baseline or application-wide element rule separately. Disabling Tailwind Preflight cannot neutralise resets from another source."
      ],
      "tokens": [
        "The generated bridge uses Tailwind 4's CSS-first `@theme static` syntax. It publishes the mapped theme variables even when a particular utility is not detected, which keeps the token surface inspectable and shareable.",
        "Functional colours use names such as `bg-govuk-brand`, `text-govuk-text`, `border-govuk-border` and `outline-govuk-focus`. The reviewed palette is also namespaced under `govuk-`; unprefixed Tailwind colours are not GOV.UK values.",
        "Static spacing uses utilities such as `p-govuk-4`; responsive GOV.UK spacing uses names such as `p-govuk-responsive-6` and follows the canonical custom property at the 641px GOV.UK tablet breakpoint.",
        "The bridge exposes `govuk-mobile:`, `govuk-tablet:` and `govuk-desktop:` variants, `max-w-govuk-page`, responsive `text-govuk-*` type-scale utilities and reviewed regular and bold weights. Breakpoints are emitted in rem using a 16px root so Tailwind sorts them consistently.",
        "Do not construct utility class names dynamically. Keep complete class names in source or register an explicit `@source` so Tailwind can detect and generate them."
      ],
      "components": [
        "Copy the official component HTML or framework translation exactly, including elements, `govuk-*` classes, IDs, `for`, `data-module` and ARIA relationships. A visually similar utility composition is not markup compatible.",
        "Keep Tailwind utilities off the internal DOM of GOV.UK Frontend components. Apply them to clearly service-owned wrapper elements only when the canonical GOV.UK layout and spacing helpers do not meet the service need.",
        "Load and initialise GOV.UK Frontend JavaScript according to the selected application-framework adapter. Tailwind has no runtime lifecycle and does not replace scoped `initAll` handling.",
        "Keep Accordion and Tabs content visible in initial HTML, retain visible focus indicators and test mouse, keyboard, focus, validation and no-JavaScript behaviour after the complete CSS build is assembled."
      ],
      "browserSupport": [
        "Tailwind CSS 4 targets Safari 16.4, Chrome 111 and Firefox 128 or newer and depends on modern CSS features. That baseline is narrower than GOV.UK Frontend's Grade C progressive-enhancement range.",
        "Check service analytics, user research and the required GOV.UK browser-support grade before adopting Tailwind 4. Do not make an essential task depend on a Tailwind 4 utility in browsers the service must support but Tailwind does not.",
        "Where older-browser presentation is required, keep essential layout and component styling in GOV.UK Frontend, or maintain a separately reviewed Tailwind 3.4 mapping and test it against the service's actual support matrix. Do not assume this Tailwind 4 bridge is source-compatible with Tailwind 3."
      ],
      "buildExampleIntro": "Import the Tailwind pieces explicitly, omit Preflight, import the generated bridge, and constrain source detection to the application paths that contain complete class names:",
      "buildExampleLanguage": "css",
      "buildExample": "@layer theme, base, components, utilities;\n\n@import \"tailwindcss/theme.css\" layer(theme);\n@import \"./ui-frameworks/tailwind/govuk-theme.css\";\n@import \"tailwindcss/utilities.css\" layer(utilities) source(none);\n\n@source \"./src\";",
      "markupExampleIntro": "Use mapped utilities on a service-owned wrapper while the official component keeps its complete GOV.UK class and JavaScript contract:",
      "markupExampleLanguage": "html",
      "markupExample": "<section class=\"bg-govuk-surface p-govuk-responsive-6 text-govuk-text\">\n  <h2 class=\"govuk-heading-m\">Application details</h2>\n  <button class=\"govuk-button\" data-module=\"govuk-button\" type=\"submit\">\n    Save and continue\n  </button>\n</section>",
      "sourceUrls": [
        {
          "name": "Tailwind CSS CLI installation",
          "url": "https://tailwindcss.com/docs/installation/tailwind-cli"
        },
        {
          "name": "Tailwind CSS theme variables",
          "url": "https://tailwindcss.com/docs/theme"
        },
        {
          "name": "Tailwind CSS Preflight",
          "url": "https://tailwindcss.com/docs/preflight"
        },
        {
          "name": "Tailwind CSS source detection",
          "url": "https://tailwindcss.com/docs/detecting-classes-in-source-files"
        },
        {
          "name": "Tailwind CSS 4 browser requirements",
          "url": "https://tailwindcss.com/docs/upgrade-guide#browser-requirements"
        },
        {
          "name": "GOV.UK Design System production setup",
          "url": "https://design-system.service.gov.uk/get-started/production/"
        },
        {
          "name": "GOV.UK Frontend browser support",
          "url": "https://frontend.design-system.service.gov.uk/browser-support/"
        },
        {
          "name": "GOV.UK Frontend JavaScript initialisation",
          "url": "https://github.com/alphagov/govuk-frontend/blob/v6.5.0/packages/govuk-frontend/src/govuk/init.mjs"
        }
      ]
    },
    {
      "id": "chakra",
      "name": "Chakra UI",
      "status": "experimental",
      "reviewedAt": "2026-09-11",
      "implementation": {
        "name": "Chakra UI",
        "package": "@chakra-ui/react",
        "version": "3.37.0"
      },